<?xml version="1.0" encoding="UTF-8"?>
<xs:schema xmlns:xs="http://www.w3.org/2001/XMLSchema">
	<xs:element name="root">
		<xs:complexType>
			<xs:sequence>
				<xs:element name="servers">
					<xs:complexType>
						<xs:sequence>
							<xs:element name="server" maxOccurs="unbounded">
								<xs:complexType>
									<xs:sequence>
										<xs:element name="enabled" type="xs:string" />
										<xs:element name="featured" type="xs:string" />
										<xs:element name="gge-server-name" type="xs:string" />
										<xs:element name="name" type="xs:string" />
									</xs:sequence>
								</xs:complexType>
							</xs:element>
						</xs:sequence>
					</xs:complexType>
				</xs:element>
			</xs:sequence>
		</xs:complexType>
	</xs:element>
</xs:schema>